購物,【2020日本眼藥水推薦】藥妝店必買人氣眼藥水總整理,2020-04-06,今天為大家推薦幾款2020日本人氣的眼藥水，相信大家一定能找到屬於自己的一款。
景點,【日本肺炎資訊】臨時休館設施懶人包（4月6日更新）,2020-04-06,今天小編將目前日本臨時休館的景點整理出來與大家分享，按原計畫旅日的朋友不要白跑一趟囉。
購物,【2020人氣日本痘痘藥】去疤除痘產品分類推薦,2020-04-06,今天小編為大家整理出日本必買祛痘、祛痘印的護膚產品，並科普相關小知識，痘肌星人必看！
購物,【2020日本濕疹藥膏推薦】10款必買蕁麻疹・濕疹・皮膚藥膏,2020-04-06,今天小編為大家介紹日本家庭常備的皮膚藥，並介紹一些關於皮膚藥的小知識！
購物,日本優惠之旅！東京攻略獨家優惠券大放送（定期更新）,2020-01-20,這次小編會把東京攻略裡對大家有用的優惠券總結在這篇攻略中，讓大家可以更方便的找到適合自己的優惠訊息。
購物,【2020台場景點推薦】DiverCity Tokyo 購物中心攻略！交通、優惠、特色店舖美食整理,2020-04-02,今天小編為大家介紹DiverCity Tokyo 購物中心的交通方式，以及有哪些好買好吃的店舖！
購物,【2020下北澤半日遊】必去人氣古著美食景點一把罩,2020-03-26,今天小編為大家介紹有「古著店之街」之稱的下北澤，必去的人氣古著店與美食景點通通都在這裡能找到！
景點,【箱根溫泉旅館】箱根經典日式溫泉飯店推薦,2018-03-29,日本箱根自古就是知名的觀光與溫泉勝地，今天小編帶你發現箱根的終極住宿露天浴池，讓你不虛此行。
景點,【2020池袋自由行】25個池袋必去的人氣景點,2020-03-18,今天小編帶大家仔細找找，池袋都有哪些景點和店舖，走過路過千萬不要錯過唷！
購物,【2020原宿景點推薦】人氣竹下通美食・貓街潮牌一手掌握,2020-03-11,今天小編將原宿好逛、好玩、好吃的地標通通介紹給大家！
購物,【日本櫻花商品推薦】值得入手的20件粉嫩單品,2020-03-05,今天小編搜集了能讓人沉浸在浪漫櫻花季裡的高顏值商品，擁有了它們就仿佛擁有美美的櫻花季！
美食,【日本拉麵攻略】帶你吃遍東京7家殿堂級人氣拉麵,2020-01-09,今天小編帶大家走進東京殿堂級的拉麵店，保證每一家都讓你吃得心滿意足！
